1,臺北市,立法院大門會客室,100臺北市中正區中山南路1號
2,臺北市,立法院議場,100臺北市中正區中山南路1號
3,臺北市,國家圖書館2樓參考室,100臺北市中正區中山南路20號
4,臺北市,國家圖書館5樓閱覽室,100臺北市中正區中山南路20號
5,臺北市,國家圖書館6樓閱覽室,100臺北市中正區中山南路20號
6,臺北市,國家圖書館B1樓閱覽室,100臺北市中正區中山南路20號
7,臺北市,國家圖書館閱覽室,100臺北市中正區中山南路20號
8,臺北市,國立中正文化中心國家戲劇院福華劇院軒入口處,100臺北市中正區中山南路21-1號
9,臺北市,國立中正文化中心國家音樂廳售票口左側,100臺北市中正區中山南路21-1號
10,臺北市,國立中正紀念堂管理處(民主大道)-7,100臺北市中正區中山南路21號
11,臺北市,國立中正紀念堂管理處堂內,100臺北市中正區中山南路21號
12,臺北市,國立中正紀念堂管理處迴廊(信義路)-5,100臺北市中正區中山南路21號
13,臺北市,國立中正紀念堂管理處迴廊(信義路)-6,100臺北市中正區中山南路21號
14,臺北市,國立中正紀念堂管理處迴廊(愛國東路)-1,100臺北市中正區中山南路21號
15,臺北市,國立中正紀念堂管理處迴廊(愛國東路)-2,100臺北市中正區中山南路21號
16,臺北市,國立中正紀念堂管理處迴廊(愛國東路)3,100臺北市中正區中山南路21號
17,臺北市,國立中正紀念堂管理處迴廊(杭州南路)-3,100臺北市中正區中山南路21號
18,臺北市,國立中正紀念堂管理處迴廊(杭州南路)-4,100臺北市中正區中山南路21號
19,臺北市,教育部一樓大廳,100臺北市中正區中山南路5號
20,臺北市,教育部前門廣場,100臺北市中正區中山南路5號
21,臺北市,國立臺灣大學附設醫院東址院區1樓大廳,100臺北市中正區中山南路7號
22,臺北市,經濟部礦務局5樓公開閱覽室,100臺北市中正區中華路1段53號5樓
23,臺北市,行政院環境保護署會客室,100臺北市中正區中華路一段83號1樓
24,臺北市,行政院環境保護署記者室,100臺北市中正區中華路一段83號3樓
25,臺北市,行政院環境保護署會議室,100臺北市中正區中華路一段83號4樓
26,臺北市,華南商業銀行中華路分行,100臺北市中正區中華路二段59號
27,臺北市,交通通訊傳播大樓10樓,100臺北市中正區仁愛路1段50號10樓
28,臺北市,交通通訊傳播大樓11樓,100臺北市中正區仁愛路1段50號11樓
29,臺北市,交通通訊傳播大樓12樓,100臺北市中正區仁愛路1段50號12樓
30,臺北市,交通通訊傳播大樓13樓,100臺北市中正區仁愛路1段50號13樓
31,臺北市,交通通訊傳播大樓14樓,100臺北市中正區仁愛路1段50號14樓
32,臺北市,交通通訊傳播大樓15樓,100臺北市中正區仁愛路1段50號15樓
33,臺北市,交通通訊傳播大樓16樓,100臺北市中正區仁愛路1段50號16樓
34,臺北市,交通通訊傳播大樓17樓,100臺北市中正區仁愛路1段50號17樓
35,臺北市,交通通訊傳播大樓18樓,100臺北市中正區仁愛路1段50號18樓
36,臺北市,交通通訊傳播大樓19樓,100臺北市中正區仁愛路1段50號19樓
37,臺北市,交通通訊傳播大樓1樓大廳,100臺北市中正區仁愛路1段50號1樓
38,臺北市,交通通訊傳播大樓20樓,100臺北市中正區仁愛路1段50號20樓
39,臺北市,交通通訊傳播大樓21樓,100臺北市中正區仁愛路1段50號21樓
40,臺北市,交通通訊傳播大樓2樓,100臺北市中正區仁愛路1段50號2樓
41,臺北市,交通通訊傳播大樓3樓,100臺北市中正區仁愛路1段50號3樓
42,臺北市,交通通訊傳播大樓7樓,100臺北市中正區仁愛路1段50號7樓
43,臺北市,交通通訊傳播大樓8樓,100臺北市中正區仁愛路1段50號8樓
44,臺北市,交通通訊傳播大樓9樓,100臺北市中正區仁愛路1段50號9樓
45,臺北市,交通通訊傳播大樓地下2樓,100臺北市中正區仁愛路1段50號地下2樓
46,臺北市,交通通信傳播大樓1樓服務台,100臺北市中正區仁愛路一段50號
47,臺北市,上海商銀仁愛分行,100臺北市中正區仁愛路二段16號
48,臺北市,臺灣銀行仁愛分行,100臺北市中正區仁愛路二段99號
49,臺北市,彰化商業銀行東門分行,100臺北市中正區信義路二段139號1樓
50,臺北市,台北東門郵局,100臺北市中正區信義路二段163號
51,臺北市,華南商業銀行信義分行,100臺北市中正區信義路二段183號
52,臺北市,台北南陽郵局,100臺北市中正區信陽街8號
53,臺北市,華山文化創意園區服務中心,100臺北市中正區八德路一段1號(中1館)
54,臺北市,中央健康保險署-臺北業務組公保大樓5樓聯合服務中心,100臺北市中正區公園路15-1號1樓
55,臺北市,交通部中央氣象局1樓大廳,100臺北市中正區公園路64號
56,臺北市,交通部中央氣象局4樓公關室,100臺北市中正區公園路64號409室
57,臺北市,兆豐國際商銀外交部簡易分行,100臺北市中正區凱達格蘭大道2號
58,臺北市,外交部1樓會客室,100臺北市中正區凱達格蘭大道2號1樓
59,臺北市,行政院院本部會客室,100臺北市中正區北平東路2號
60,臺北市,文化部1樓,100臺北市中正區北平東路30-1號
61,臺北市,臺灣港務股份有限公司臺北聯絡處,100臺北市中正區北平東路3號3樓3021室
62,臺北市,台北火車站郵局,100臺北市中正區北平西路3號
63,臺北市,臺鐵局臺北站R13票房,100臺北市中正區北平西路3號
64,臺北市,臺鐵局臺北站地下一樓東南角,100臺北市中正區北平西路3號
65,臺北市,臺鐵局臺北站地下三樓剪收票口(R13),100臺北市中正區北平西路3號
66,臺北市,臺鐵局臺北站大廳東側,100臺北市中正區北平西路3號
67,臺北市,臺鐵局臺北站大廳西側,100臺北市中正區北平西路3號
68,臺北市,臺鐵局臺北站東剪票入口(地下1樓),100臺北市中正區北平西路3號
69,臺北市,臺鐵局臺北站西剪票入口(地下1樓),100臺北市中正區北平西路3號
70,臺北市,交通部臺灣鐵路管理局第9會議室,100臺北市中正區北平西路3號3樓
71,臺北市,交通部臺灣鐵路管理局局第9會議室,100臺北市中正區北平西路3號3樓3081室
72,臺北市,臺鐵局行政處檔案閱覽室,100臺北市中正區北平西路3號4樓4101室
73,臺北市,交通部臺灣鐵路管理局演藝廳-1,100臺北市中正區北平西路3號5樓
74,臺北市,交通部臺灣鐵路管理局演藝廳-2,100臺北市中正區北平西路3號5樓
75,臺北市,交通部臺灣鐵路管理局演藝廳-3,100臺北市中正區北平西路3號5樓
76,臺北市,交通部臺灣鐵路管理局第1會議室-1,100臺北市中正區北平西路3號5樓
77,臺北市,交通部臺灣鐵路管理局第1會議室-2,100臺北市中正區北平西路3號5樓
78,臺北市,交通部臺灣鐵路管理局第2會議室,100臺北市中正區北平西路3號5樓
79,臺北市,交通部臺灣鐵路管理局第3會議室,100臺北市中正區北平西路3號5樓
80,臺北市,臺鐵局秘書室新聞聯絡室,100臺北市中正區北平西路3號5樓5007室
81,臺北市,交通部臺灣鐵路管理局局第1會議室-1,100臺北市中正區北平西路3號5樓5036室
82,臺北市,交通部臺灣鐵路管理局局第1會議室-2,100臺北市中正區北平西路3號5樓5036室
83,臺北市,臺鐵局材料處公開閱覽室,100臺北市中正區北平西路3號5樓5075室
84,臺北市,交通部臺灣鐵路管理局局演藝廳-1,100臺北市中正區北平西路3號5樓5136室
85,臺北市,交通部臺灣鐵路管理局局演藝廳-3,100臺北市中正區北平西路3號5樓5136室
86,臺北市,交通部臺灣鐵路管理局第4會議室,100臺北市中正區北平西路3號6樓
87,臺北市,交通部臺灣鐵路管理局第5會議室,100臺北市中正區北平西路3號6樓
88,臺北市,交通部臺灣鐵路管理局文檔科檔案室,100臺北市中正區北平西路3號6樓6002室
89,臺北市,臺鐵局秘書室國會聯絡室,100臺北市中正區北平西路3號6樓6002室
90,臺北市,交通部臺灣鐵路管理局局第4會議室,100臺北市中正區北平西路3號6樓6007室
91,臺北市,交通部臺灣鐵路管理局局第5會議室,100臺北市中正區北平西路3號6樓6046室
92,臺北市,國立臺灣博物館南門園區小白宮展演廳,100臺北市中正區南昌路1段1號
93,臺北市,國立臺灣博物館南門園區紅樓1樓,100臺北市中正區南昌路1段1號
94,臺北市,國立臺灣博物館南門園區紅樓2樓,100臺北市中正區南昌路1段1號
95,臺北市,國立臺灣博物館南門園區行政大樓,100臺北市中正區南昌路1段1號
96,臺北市,內政部警政署保安警察第六總隊1F,100臺北市中正區南昌路一段10號1F
97,臺北市,內政部警政署保安警察第六總隊2F,100臺北市中正區南昌路一段10號2F
98,臺北市,台北古亭郵局,100臺北市中正區南昌路二段232號
99,臺北市,第一商業銀行(南門分行),100臺北市中正區南昌路１段94號
100,臺北市,文化部-南海工作坊,100臺北市中正區南海路20號9樓
101,臺北市,行政院農業委員會1樓記者室,100臺北市中正區南海路37號
102,臺北市,行政院農業委員會2樓,100臺北市中正區南海路37號
103,臺北市,行政院農業委員會10樓,100臺北市中正區南海路37號10樓
104,臺北市,行政院農業委員會10樓辦公區,100臺北市中正區南海路37號10樓
105,臺北市,行政院農業委員會1樓圓崗,100臺北市中正區南海路37號1樓
106,臺北市,行政院農業委員會1樓大廳,100臺北市中正區南海路37號1樓
107,臺北市,行政院農業委員會2樓辦公區,100臺北市中正區南海路37號2樓
108,臺北市,行政院農業委員會3樓,100臺北市中正區南海路37號3樓
109,臺北市,行政院農業委員會3樓辦公區,100臺北市中正區南海路37號3樓
110,臺北市,行政院農業委員會4樓,100臺北市中正區南海路37號4樓
111,臺北市,行政院農業委員會4樓辦公區,100臺北市中正區南海路37號4樓
112,臺北市,行政院農業委員會5F右側,100臺北市中正區南海路37號5樓右側
113,臺北市,行政院農業委員會5F左側,100臺北市中正區南海路37號5樓左側
114,臺北市,行政院農業委員會6樓,100臺北市中正區南海路37號6樓
115,臺北市,行政院農業委員會7樓,100臺北市中正區南海路37號7樓
116,臺北市,行政院農業委員會7樓辦公區,100臺北市中正區南海路37號7樓
117,臺北市,行政院農業委員會8樓,100臺北市中正區南海路37號8樓
118,臺北市,行政院農業委員會8樓辦公區,100臺北市中正區南海路37號8樓
119,臺北市,行政院農業委員會9樓,100臺北市中正區南海路37號9樓
120,臺北市,行政院農業委員會9樓辦公區,100臺北市中正區南海路37號9樓
121,臺北市,行政院農業委員會地下1樓圖書室,100臺北市中正區南海路37號地下1樓
122,臺北市,中國輸出入銀行總行,100臺北市中正區南海路3號8樓
123,臺北市,國立教育廣播電臺服務中心,100臺北市中正區南海路41號
124,臺北市,國立臺灣工藝研究發展中心-臺北當代工藝設計分館2F-4F,100臺北市中正區南海路41號
125,臺北市,國立臺灣工藝研究發展中心-臺北當代工藝設計分館5F-7F,100臺北市中正區南海路41號
126,臺北市,國立臺灣藝術教育館南海書院第2會議室,100臺北市中正區南海路43號
127,臺北市,國立臺灣藝術教育館圖書室,100臺北市中正區南海路43號
128,臺北市,國立歷史博物館戶外廣場,100臺北市中正區南海路49號
129,臺北市,台北植物園布政使司文物館,100臺北市中正區南海路53號
130,臺北市,林業試驗所行政大樓,100臺北市中正區南海路53號
131,臺北市,臺灣高等法院刑事庭大廈,100臺北市中正區博愛路127號
132,臺北市,臺灣高等法院檢察署為民服務中心,100臺北市中正區博愛路127號
133,臺北市,臺灣臺北地方法院2樓民眾休息區,100臺北市中正區博愛路131號
134,臺北市,臺灣臺北地方法院檢察署1F民眾等候區,100臺北市中正區博愛路131號
135,臺北市,國史館郵局,100臺北市中正區博愛路168號之1
136,臺北市,臺灣土地銀行臺北分行,100臺北市中正區博愛路72號
137,臺北市,華南商業銀行城內分行,100臺北市中正區博愛路93號
138,臺北市,行政院農業委員會林務局農林航空測量所,100臺北市中正區和平西路2段100號1樓
139,臺北市,漁業署和平大樓4樓會議室,100臺北市中正區和平西路二段100號4樓
140,臺北市,漁業署和平大樓6樓圖書室,100臺北市中正區和平西路二段100號6樓
141,臺北市,漁業署和平大樓7樓會議室,100臺北市中正區和平西路二段100號7樓
142,臺北市,漁業署和平大樓8樓會議室,100臺北市中正區和平西路二段100號8樓
143,臺北市,台北龍口郵局,100臺北市中正區和平西路二段68號
144,臺北市,行政院發言人辦公室接待中心,100臺北市中正區天津街2號
145,臺北市,經濟部國營事業委員會1樓大廳,100臺北市中正區寶慶路25號
146,臺北市,經濟部國營事業委員會4樓,100臺北市中正區寶慶路25號4F
147,臺北市,經濟部國營事業委員會5樓,100臺北市中正區寶慶路25號5F
148,臺北市,經濟部國營事業委員會6樓,100臺北市中正區寶慶路25號6F
149,臺北市,經濟部國營事業委員會7樓,100臺北市中正區寶慶路25號7F
150,臺北市,國家發展委員會寶慶辦公區,100臺北市中正區寶慶路3號
151,臺北市,台北螢橋郵局,100臺北市中正區廈門街76號
152,臺北市,內政部移民署臺北市服務站,100臺北市中正區廣州街15號1樓及地下1樓
153,臺北市,內政部警政署警察廣播電臺服務中心,100臺北市中正區廣州街17號
154,臺北市,台北南門郵局,100臺北市中正區廣州街2號
155,臺北市,行政院主計總處(廣博大樓),100臺北市中正區廣州街2號
156,臺北市,國家通訊傳播委員會北區監理處服務中心,100臺北市中正區延平南路143號2樓
157,臺北市,國家圖書館藝術暨視聽資料中心,100臺北市中正區延平南路156號
158,臺北市,役政署北部辦公室,100臺北市中正區延平南路45號1樓
159,臺北市,內政部8樓會議室,100臺北市中正區徐州路5號
160,臺北市,教育部青年發展署,100臺北市中正區徐州路5號14樓
161,臺北市,中央聯合辦公大樓南棟,100臺北市中正區徐州路5號1樓
162,臺北市,僑務委員會中央聯合辦公大樓南棟,100臺北市中正區徐州路5號3樓
163,臺北市,內政部,100臺北市中正區徐州路5號3樓
164,臺北市,文化部-蒙藏文化中心,100臺北市中正區徐州路5號4樓
165,臺北市,內政部政務次長室,100臺北市中正區徐州路5號9樓
166,臺北市,內政部部長室貴賓室,100臺北市中正區徐州路5號9樓
167,臺北市,台北中聯郵局,100臺北市中正區徐州路5號地下一樓
168,臺北市,行政院主計總處(院區),100臺北市中正區忠孝東路1段1號
169,臺北市,行政院院史珍貴史料展示,100臺北市中正區忠孝東路1段1號
170,臺北市,行政院院本部公共區域,100臺北市中正區忠孝東路一段1號
171,臺北市,內政部警政署,100臺北市中正區忠孝東路一段7號
172,臺北市,兆豐國際商銀金控總部分行,100臺北市中正區忠孝東路二段123號
173,臺北市,兆豐國際商業銀行企劃處10樓,100臺北市中正區忠孝東路二段123號10樓
174,臺北市,兆豐國際商業銀行債務管理處13樓,100臺北市中正區忠孝東路二段123號13樓
175,臺北市,兆豐國際商業銀行總務處4樓,100臺北市中正區忠孝東路二段123號4樓
176,臺北市,第一商業銀行(忠孝路分行),100臺北市中正區忠孝東路２段94號
177,臺北市,台北北門郵局-1,100臺北市中正區忠孝西路一段114號
178,臺北市,台北北門郵局-2,100臺北市中正區忠孝西路一段114號
179,臺北市,台北北門郵局-3,100臺北市中正區忠孝西路一段114號
180,臺北市,台北北門郵局-4,100臺北市中正區忠孝西路一段114號
181,臺北市,台北北門郵局-5,100臺北市中正區忠孝西路一段114號
182,臺北市,台北復興橋郵局,100臺北市中正區忠孝西路一段1號
183,臺北市,財政部8樓大禮堂,100臺北市中正區愛國西路2號
184,臺北市,華南商業銀行新生分行,100臺北市中正區新生南路一段48號
185,臺北市,審計部5樓會議室,100臺北市中正區杭州北路1號
186,臺北市,農業金融局2樓會議室,100臺北市中正區杭州南路一段15號
187,臺北市,農業金融局3樓右側,100臺北市中正區杭州南路一段15號
188,臺北市,農業金融局3樓會議室,100臺北市中正區杭州南路一段15號
189,臺北市,行政院農業委員會農糧署,100臺北市中正區杭州南路一段15號6樓
190,臺北市,台北杭南郵局,100臺北市中正區杭州南路一段23號之3
191,臺北市,交通部國際會議中心1、2樓,100臺北市中正區杭州南路一段24號
192,臺北市,交通部國際會議中心3、4樓,100臺北市中正區杭州南路一段24號
193,臺北市,交通部國際會議中心5樓,100臺北市中正區杭州南路一段24號
194,臺北市,台北仁杭郵局,100臺北市中正區杭州南路一段24號1樓
195,臺北市,林務局1樓記者室、2樓會議室、5樓會議室,100臺北市中正區杭州南路一段2號
196,臺北市,林務局2樓大禮堂、7樓會議室,100臺北市中正區杭州南路一段2號
197,臺北市,林務局8樓會議室,100臺北市中正區杭州南路一段2號
198,臺北市,疾病管制署-疫遊館,100臺北市中正區林森南路6號1樓
199,臺北市,臺灣銀行採購部,100臺北市中正區武昌街一段45號3樓
200,臺北市,三軍總醫院汀州院區1樓門診大廳,100臺北市中正區汀州路三段40號
201,臺北市,台北汀洲郵局,100臺北市中正區汀洲路三段301號
202,臺北市,經濟部國際貿易局2樓廠商服務區,100臺北市中正區湖口街1號
203,臺北市,財政部臺北國稅局中正分局民眾服務區,100臺北市中正區潮州街2號1樓
204,臺北市,聯合辦公大樓北棟大廳民眾洽公區,100臺北市中正區濟南路1段2-2號1樓
205,臺北市,國家通訊傳播委員會濟南路辦公室1樓,100臺北市中正區濟南路2段16號1樓
206,臺北市,國家通訊傳播委員會濟南路辦公室2樓,100臺北市中正區濟南路2段16號2樓
207,臺北市,國家通訊傳播委員會濟南路辦公室7樓,100臺北市中正區濟南路2段16號7樓
208,臺北市,立法院郵局,100臺北市中正區濟南路一段1號
209,臺北市,行政院人事行政總處,100臺北市中正區濟南路一段2-2號10樓
210,臺北市,國家發展委員會濟南辦公區,100臺北市中正區濟南路一段2-2號6樓
211,臺北市,外交部領事事務局(3樓大廳),100臺北市中正區濟南路一段2之2號3樓
212,臺北市,外交部領事事務局(3樓詢問台),100臺北市中正區濟南路一段2之2號3樓
213,臺北市,立法院委員研究大樓會客室,100臺北市中正區濟南路一段3之1號
214,臺北市,標準檢驗局報驗發證業務民眾洽公區,100臺北市中正區濟南路一段4號
215,臺北市,標準檢驗局資料中心閱覽室,100臺北市中正區濟南路一段4號
216,臺北市,文化部齊東詩舍,100臺北市中正區濟南路二段27號
217,臺北市,行政院勞動部勞工保險局國民年金業務處洽公櫃台,100臺北市中正區濟南路二段42號1樓
218,臺北市,經濟部C203會議室,100臺北市中正區福州街15號1樓
219,臺北市,經濟部訓練教室1樓,100臺北市中正區福州街15號1樓
220,臺北市,經濟部訓練教室2、3樓,100臺北市中正區福州街15號2樓
221,臺北市,經濟部簡報會議室,100臺北市中正區福州街15號A棟1樓
222,臺北市,經濟部第二會議室,100臺北市中正區福州街15號B棟1樓
223,臺北市,經濟部記者室,100臺北市中正區福州街15號B棟1樓
224,臺北市,經濟部總務司開標室,100臺北市中正區福州街15號D207室
225,臺北市,經濟部商業司民眾服務大廳,100臺北市中正區福州街15號D棟1樓
226,臺北市,兆豐國際商銀,100臺北市中正區福州街16號
227,臺北市,兆豐國際商銀福州大樓,100臺北市中正區福州街16號3樓
228,臺北市,兆豐國際商業銀行資訊處福州街大樓8樓,100臺北市中正區福州街16號8樓
229,臺北市,台北中山堂郵局,100臺北市中正區秀山街1號
230,臺北市,行政院環境保護署第2辦公室會議室(12F),100臺北市中正區秀山街4號12樓
231,臺北市,行政院環境保護署第2辦公室會議室(13F),100臺北市中正區秀山街4號13樓
232,臺北市,行政院環境保護署第2辦公室會議室(14F),100臺北市中正區秀山街4號14樓
233,臺北市,勞動部北區勞動檢查所會客室,100臺北市中正區紹興北街31巷39號
234,臺北市,投審會5樓辦公區,100臺北市中正區羅斯福路1段7號5樓
235,臺北市,投審會8樓辦公區,100臺北市中正區羅斯福路1段7號8樓
236,臺北市,兆豐國際商銀南台北分行,100臺北市中正區羅斯福路2段9-1號
237,臺北市,行政院勞動部勞工保險局臺北市辦事處洽公櫃台,100臺北市中正區羅斯福路一段4號1樓
238,臺北市,華南商業銀行公館分行,100臺北市中正區羅斯福路三段216號
239,臺北市,台電公司台電大樓主樓會客室,100臺北市中正區羅斯福路三段242號
240,臺北市,台電公司台電大樓副樓會客室,100臺北市中正區羅斯福路三段242號
241,臺北市,中油公司台北直銷中心,100臺北市中正區莒光路2號2樓
242,臺北市,彰化商業銀行城內分行,100臺北市中正區衡陽路68號1樓
243,臺北市,彰化商業銀行證券經紀商台北總公司,100臺北市中正區衡陽路68號3樓
244,臺北市,兆豐國際商銀衡陽分行,100臺北市中正區衡陽路91號
245,臺北市,兆豐國際商銀-衡陽大樓7樓之1,100臺北市中正區衡陽路91號7樓
246,臺北市,兆豐國際商銀-衡陽大樓8樓之1,100臺北市中正區衡陽路91號8樓
247,臺北市,國立臺灣博物館土銀館1F服務台,100臺北市中正區襄陽路25號
248,臺北市,國立臺灣博物館土銀館展示室,100臺北市中正區襄陽路25號
249,臺北市,國立臺灣博物館本館1F服務台,100臺北市中正區襄陽路2號
250,臺北市,國立臺灣博物館本館1F東展示室,100臺北市中正區襄陽路2號
251,臺北市,國立臺灣博物館本館1F西展示室,100臺北市中正區襄陽路2號
252,臺北市,國立臺灣博物館本館3F展示室,100臺北市中正區襄陽路2號
253,臺北市,國立臺灣博物館本館3F視聽教室,100臺北市中正區襄陽路2號
254,臺北市,兆豐國際商銀城中分行,100臺北市中正區許昌街42號
255,臺北市,最高法院檢察署,100臺北市中正區貴陽街1段235號
256,臺北市,臺灣銀行公庫部,100臺北市中正區貴陽街一段120號
257,臺北市,臺灣高等法院民事庭大廈,100臺北市中正區貴陽街一段233號
258,臺北市,國防部中華福利站服務台,100臺北市中正區貴陽街一段243號
259,臺北市,華南商業銀行營業部,100臺北市中正區重慶南路1段38號
260,臺北市,郵政博物館,100臺北市中正區重慶南路2段45號
261,臺北市,臺灣銀行營業部,100臺北市中正區重慶南路一段120號
262,臺北市,法務部2樓會議室,100臺北市中正區重慶南路一段130號
263,臺北市,彰化商業銀行臺北分行,100臺北市中正區重慶南路一段27號
264,臺北市,第一商業銀行營業部分行,100臺北市中正區重慶南路一段30號
265,臺北市,第一金融控股股份有限公司,100臺北市中正區重慶南路一段30號18樓
266,臺北市,台北南海郵局,100臺北市中正區重慶南路二段43號
267,臺北市,彰化商業銀行中正分行,100臺北市中正區金山南路一段47號1樓
268,臺北市,文化部影視及流行音樂產業局,100臺北市中正區開封街一段三號
269,臺北市,上海商銀城中分行,100臺北市中正區館前路28號
270,臺北市,臺灣土地銀行營業部,100臺北市中正區館前路46號
271,臺北市,臺灣銀行館前分行,100臺北市中正區館前路49號
272,臺北市,行政院台商聯合服務中心,100臺北市中正區館前路71號8樓
273,臺北市,合庫營業部營業廳,100臺北市中正區館前路77號
274,臺北市,北捷松山線北門站B1F連通道西側,100臺北市中正區黎明里北平西路3號
275,臺北市,站前地下街(Z區)Z7出口旁,100臺北市中正區黎明里北平西路3號
276,臺北市,臺北站地下1樓北迴廊臺鐵便當本舖3號店旁,100臺北市中正區黎明里北平西路3號
277,臺北市,臺北站地下1樓北迴廊西側置物櫃旁,100臺北市中正區黎明里北平西路3號
278,臺北市,臺鐵局臺北站地下1樓北迴廊自動售票機旁,100臺北市中正區黎明里北平西路3號
279,臺北市,臺鐵局臺北站地下1樓機場捷運連通道北迴廊東側,100臺北市中正區黎明里北平西路3號
280,臺北市,臺鐵局臺北站地下1樓機場捷運連通道北迴廊西側,100臺北市中正區黎明里北平西路3號
281,臺北市,臺鐵局臺北站地下1樓機場捷運連通道南迴廊東側,100臺北市中正區黎明里北平西路3號
