4691,臺中市,統一超商台中霧峰中正路萬峰店(公話),413臺中市霧峰區中正路146號之20
4692,臺中市,統一超商台中霧峰中正路坑口店(公話),413臺中市霧峰區中正路563號
4693,臺中市,立法院中部辦公室議政博物館,413臺中市霧峰區中正路734號
4694,臺中市,國立臺灣交響樂團行政大樓1F服務台,413臺中市霧峰區中正路738-2號
4695,臺中市,參山國家風景區管理處處本部服務台,413臺中市霧峰區中正路738號
4696,臺中市,參山國家風景區管理處處本部4樓,413臺中市霧峰區中正路739號
4697,臺中市,中油公司台中市霧峰區霧峰站,413臺中市霧峰區中正路784號
4698,臺中市,全家便利商店霧峰中正路金來店(公話),413臺中市霧峰區中正路803號
4699,臺中市,臺中市公車霧峰郵局站,413臺中市霧峰區中正路806號
4700,臺中市,霧峰郵局,413臺中市霧峰區中正路806號
4701,臺中市,臺灣銀行霧峰分行,413臺中市霧峰區中正路838號
4702,臺中市,臺中市公車霧峰站,413臺中市霧峰區中正路863號
4703,臺中市,彰化商業銀行霧峰分行,413臺中市霧峰區中正路900號
4704,臺中市,統一超商霧峰中正路新霧峰店(公話),413臺中市霧峰區中正路916號
4705,臺中市,全家便利商店霧峰五福店(公話),413臺中市霧峰區六股路292號
4706,臺中市,統一超商霧峰吉峰路新峰店(公話),413臺中市霧峰區吉峰路153號
4707,臺中市,臺中市霧峰區戶政事務所,413臺中市霧峰區吉峰路16號
4708,臺中市,統一超商霧峰四德路丁台店(公話),413臺中市霧峰區四德路392號
4709,臺中市,統一超商霧峰四德路四德店(公話),413臺中市霧峰區四德路525號之2
4710,臺中市,OK超商霧峰四德路霧峰店(公話),413臺中市霧峰區四德路575號
4711,臺中市,全家便利商店霧峰四德路金德店(公話),413臺中市霧峰區四德路576號
4712,臺中市,臺中市霧峰區公所,413臺中市霧峰區大同路20號
4713,臺中市,臺中市霧峰區公所,413臺中市霧峰區大同路20號
4714,臺中市,臺中市霧峰區以文圖書館,413臺中市霧峰區大同路8號
4715,臺中市,水利署第三河川局1樓服務台,413臺中市霧峰區峰堤路191號
4716,臺中市,水利署中區水資源局1樓服務台,413臺中市霧峰區峰堤路195號
4717,臺中市,自來水公司霧峰營運所,413臺中市霧峰區德泰街70巷5號
4718,臺中市,統一超商霧峰德泰街吉峰店(公話),413臺中市霧峰區德泰街9號
4719,臺中市,統一超商霧峰柳豐路易鴻店(公話),413臺中市霧峰區柳豐路422號
4720,臺中市,臺中市公車王厝站,413臺中市霧峰區柳豐路498號
4721,臺中市,臺中市公車亞洲大學安藤館站,413臺中市霧峰區柳豐路500號
4722,臺中市,臺中市統一超商霧峰樹仁路育成店(公話),413臺中市霧峰區樹仁路161號之1
4723,臺中市,臺中市統一超商霧峰樹仁路峰資店(公話),413臺中市霧峰區樹仁路26號
4724,臺中市,臺中市霧峰區衛生所,413臺中市霧峰區民生路1之9號
4725,臺中市,全家便利商店霧峰區民生路吉峰店(公話),413臺中市霧峰區民生路353號
4726,臺中市,霧峰民生路郵局,413臺中市霧峰區民生路93號
4727,臺中市,行政院農業委員會農業藥物毒物試驗所教育訓練中心一樓大廳與第一會議室,413臺中市霧峰區舊正里光明路11號
4728,臺中市,全家便利商店霧峰草湖路新振興店(公話),413臺中市霧峰區草湖路49號
4729,臺中市,全家便利商店霧峰錦州路新錦峰店(公話),413臺中市霧峰區錦州路331號
4730,臺中市,全家便利商店烏日三榮路高捷店(公話),414臺中市烏日區三榮路二段350號
4731,臺中市,全家便利商店烏日三民街三民店(公話),414臺中市烏日區三民街142號
4732,臺中市,臺鐵局烏日站候車室,414臺中市烏日區三民街258號
4733,臺中市,全家便利商店烏日中山路成功店(公話),414臺中市烏日區中山路3段242號公話
4734,臺中市,臺灣土地銀行烏日分行,414臺中市烏日區中山路一段535號1、2樓
4735,臺中市,統一超商烏日中山路榮泉店(公話),414臺中市烏日區中山路三段1007號
4736,臺中市,OK超商烏日中山路成功店(公話),414臺中市烏日區中山路三段500號
4737,臺中市,臺鐵局成功站候車室,414臺中市烏日區中山路三段550號
4738,臺中市,統一超商烏日中山路鼎好店(公話),414臺中市烏日區中山路二段289號1樓
4739,臺中市,全家便利商店烏日中華路新九德店(公話),414臺中市烏日區中華路326號
4740,臺中市,統一超商烏日中華路九德店(公話),414臺中市烏日區中華路45號
4741,臺中市,自來水公司烏日營運所,414臺中市烏日區五光路1031號
4742,臺中市,全家便利商店烏日五光路金鴿店(公話),414臺中市烏日區五光路95號之3
4743,臺中市,烏日明道郵局,414臺中市烏日區仁德村信義街100號
4744,臺中市,全家便利商店烏日信義街新明道店(公話),414臺中市烏日區信義街157號
4745,臺中市,統一超商台中烏日信義街162號(公話),414臺中市烏日區信義街162號
4746,臺中市,烏日郵局,414臺中市烏日區光日路123號
4747,臺中市,中油公司台中市烏日區服務中心,414臺中市烏日區光日路223號
4748,臺中市,臺中市全家便利商店烏日光日路烏日高鐵店(公話),414臺中市烏日區光日路356號
4749,臺中市,全家便利商店烏日公園路日光日店(公話),414臺中市烏日區公園路306號
4750,臺中市,全家便利商店烏日學田路成嶺店(公話),414臺中市烏日區學田路719號
4751,臺中市,統一超商烏日新興路烏日店((公話),414臺中市烏日區新興路247號
4752,臺中市,臺中市烏日區公所,414臺中市烏日區新興路316號
4753,臺中市,統一超商烏日溪南路東園店(公話),414臺中市烏日區溪南路一段375號
4754,臺中市,全家便利商店烏日溪南路新溪南店(公話),414臺中市烏日區溪南路一段659號
4755,臺中市,烏日溪壩郵局,414臺中市烏日區溪南路二段372號
4756,臺中市,統一超商烏日溪南路喀哩店(公話),414臺中市烏日區溪南路二段380號
4757,臺中市,臺中市烏日區圖書館,414臺中市烏日區興祥街121號
4758,臺中市,臺中市烏日區衛生所,414臺中市烏日區長樂街136號
4759,臺中市,臺鐵局新烏日站2樓付費區大廳,414臺中市烏日區高鐵東一路26號
4760,臺中市,臺鐵局新烏日站候車室,414臺中市烏日區高鐵東一路26號
4761,臺中市,臺鐵局新烏日站第1月台行車室,414臺中市烏日區高鐵東一路26號
4762,臺中市,臺鐵局新烏日站第1月臺北候車區,414臺中市烏日區高鐵東一路26號
4763,臺中市,臺中市台鐵新烏日站(公話),414臺中市烏日區高鐵東一路26號2樓
4764,臺中市,臺中市台鐵新烏日站台灣鐵道故事館(公話),414臺中市烏日區高鐵東一路26號2樓
4765,臺中市,臺中市烏日區戶政事務所,414臺中市烏日區高鐵路一段170號
4766,臺中市,豐原三民路郵局,420臺中市豐原區三民路108號
4767,臺中市,統一超商豐原三民路豐三民店(公話),420臺中市豐原區三民路38號
4768,臺中市,臺中市豐原客運總站(公話),420臺中市豐原區三民路46號
4769,臺中市,統一超商豐原三民路新豐民店(公話),420臺中市豐原區三民路93號1樓
4770,臺中市,上海商銀豐原分行,420臺中市豐原區三民路95號
4771,臺中市,統一超商豐原三豐路豐后店(公話),420臺中市豐原區三豐路692號
4772,臺中市,統一超商豐原三豐路三豐路店(公話),420臺中市豐原區三豐路909號
4773,臺中市,統一超商豐原三豐路欣三豐店(公話),420臺中市豐原區三豐路91號
4774,臺中市,統ㄧ超商豐原三豐路豐王店(公話),420臺中市豐原區三豐路940號
4775,臺中市,臺中市地方稅務局_豐原分局,420臺中市豐原區中山路219號
4776,臺中市,內政部移民署臺中市第二服務站,420臺中市豐原區中山路280號
4777,臺中市,第一商業銀行豐原分行,420臺中市豐原區中山路423號
4778,臺中市,臺中市公車豐原高商站,420臺中市豐原區中山路428號
4779,臺中市,臺灣土地銀行豐原分行,420臺中市豐原區中山路508號
4780,臺中市,統一超商豐原中山路豐光店(公話),420臺中市豐原區中山路581號
4781,臺中市,臺鐵局豐原站2樓付費區站長室,420臺中市豐原區中正路1-1號
4782,臺中市,臺鐵局豐原站2樓非付費區販賣部,420臺中市豐原區中正路1-1號
4783,臺中市,臺鐵局豐原站第1月台5車位置,420臺中市豐原區中正路1-1號
4784,臺中市,臺鐵局豐原站第2月台11車位置,420臺中市豐原區中正路1-1號
4785,臺中市,臺鐵局豐原站第2月台5車位置,420臺中市豐原區中正路1-1號
4786,臺中市,臺中市豐原廟東復興商圈(中正路115號),420臺中市豐原區中正路115號
4787,臺中市,臺灣土地銀行豐農分行,420臺中市豐原區中正路127號
4788,臺中市,臺中市豐原廟東復興商圈(中正路172號),420臺中市豐原區中正路172號
4789,臺中市,臺鐵局豐原站候車室,420臺中市豐原區中正路1號
4790,臺中市,臺鐵局豐原站售票前廳,420臺中市豐原區中正路1號
4791,臺中市,臺鐵局豐原站第2月台4車處,420臺中市豐原區中正路1號
4792,臺中市,彰化商業銀行豐原分行,420臺中市豐原區中正路220號1樓
4793,臺中市,豐原中正路郵局,420臺中市豐原區中正路298號
4794,臺中市,臺灣銀行豐原分行,420臺中市豐原區中正路302號
4795,臺中市,統一超商豐原中正路瑞興店(公話),420臺中市豐原區中正路497號
4796,臺中市,兆豐國際商銀豐原分行,420臺中市豐原區中正路519號
4797,臺中市,台電公司豐原分處服務中心營業廳,420臺中市豐原區中正路599號
4798,臺中市,豐原葫蘆墩文化旅遊派出所前公話亭,420臺中市豐原區中正路5號
4799,臺中市,全家便利商店豐原中正路葫蘆墩店(公話),420臺中市豐原區中正路693號
4800,臺中市,統一超商豐原中正路京達店(公話),420臺中市豐原區中正路805號
4801,臺中市,臺中市公車頂街站,420臺中市豐原區中正路81號
4802,臺中市,臺中市衛生局,420臺中市豐原區中興路136號
4803,臺中市,臺中市豐原區衛生所,420臺中市豐原區中興路136號
4804,臺中市,統一超商豐原中興路新豐興店(公話),420臺中市豐原區中興路57號
4805,臺中市,統一超商豐原保康路保康店(公話),420臺中市豐原區保康路160號
4806,臺中市,全家便利商店豐原信義街金美店(公話),420臺中市豐原區信義街60號
4807,臺中市,華南商業銀行豐原分行,420臺中市豐原區信義街95號
4808,臺中市,自來水公司豐原服務所,420臺中市豐原區南陽路298巷15號
4809,臺中市,統一超商豐原南陽路茂陽店(公話),420臺中市豐原區南陽路299號之8
4810,臺中市,統一超商豐原南陽路豐陽店(公話),420臺中市豐原區南陽路372號
4811,臺中市,統一超商豐原南陽路萳陽店(公話),420臺中市豐原區南陽路480號
4812,臺中市,財政部中區國稅局豐原分局,420臺中市豐原區南陽路515號
4813,臺中市,全家便利商店豐原南陽路綠山店(公話),420臺中市豐原區南陽路60號
4814,臺中市,行政院農業委員會林務局東勢林區管理處,420臺中市豐原區南陽路逸仙莊1號
4815,臺中市,豐原南陽郵局,420臺中市豐原區南陽里12鄰圓環東路402號
4816,臺中市,統一超商豐原向陽路豐鑫店(公話),420臺中市豐原區向陽路276號
4817,臺中市,華南商業銀行西豐原分行,420臺中市豐原區圓環南路225號
4818,臺中市,臺中市交通事件裁決處,420臺中市豐原區圓環南路70號
4819,臺中市,全家便利商店豐原圓環南路中興店(公話),420臺中市豐原區圓環南路76號
4820,臺中市,統一超商豐原圓環東路甜心店(公話),420臺中市豐原區圓環東路168號
4821,臺中市,臺中市葫蘆墩文化中心,420臺中市豐原區圓環東路782號
4822,臺中市,全家便利商店豐原大豐路社皮店(公話),420臺中市豐原區大豐路五段450號
4823,臺中市,豐原醫院-復健大樓1樓門診區,420臺中市豐原區安康路100號
4824,臺中市,豐原醫院-急重症大樓1樓急診區,420臺中市豐原區安康路100號
4825,臺中市,豐原醫院-醫療大樓1樓門診區,420臺中市豐原區安康路100號
4826,臺中市,豐原醫院-門診大樓1樓門診區,420臺中市豐原區安康路100號
4827,臺中市,臺中市豐原區公所,420臺中市豐原區市政路2號
4828,臺中市,臺中市豐原區圖書館,420臺中市豐原區市政路2號
4829,臺中市,臺中市豐原區戶政事務所,420臺中市豐原區市政路2號
4830,臺中市,臺中市統一超商豐原復興路復興店(公話),420臺中市豐原區復興路75號
4831,臺中市,統一超商豐原成功路京泰店(公話),420臺中市豐原區成功路195號
4832,臺中市,行政院勞動部勞工保險局臺中市第二辦事處洽公櫃台,420臺中市豐原區成功路616號
4833,臺中市,臺中市豐原漆藝館,420臺中市豐原區水源路1-1號
4834,臺中市,統一超商豐原水源路葫蘆墩店(公話),420臺中市豐原區水源路127號之1
4835,臺中市,臺中市公車豐原高中站,420臺中市豐原區水源路162號
4836,臺中市,臺中市豐原區圖書館南嵩分館,420臺中市豐原區水源路17巷2號
4837,臺中市,全家便利商店豐原水源路水源店(公話),420臺中市豐原區水源路17號
4838,臺中市,統一超商豐原水源路豐原道店(公話),420臺中市豐原區水源路307號
4839,臺中市,豐原水源郵局,420臺中市豐原區水源路594-2號
4840,臺中市,全家便利商店豐原永康路永康店(公話),420臺中市豐原區永康路215號之1
4841,臺中市,臺中市共好社宅-豐原安康段,420臺中市豐原區永康路280號
4842,臺中市,全家便利商店豐原田心路甜心店(公話),420臺中市豐原區田心路2段271號
4843,臺中市,豐原中山路郵局,420臺中市豐原區田心里大明路12號
4844,臺中市,全家便利商店豐原社興五街社興店(公話),420臺中市豐原區社興五街1號
4845,臺中市,勞動部勞動力發展署中彰投分署豐原就業中心3F,420臺中市豐原區社興路37號
4846,臺中市,勞動部勞動力發展署中彰投分署豐原就業中心洽公櫃台,420臺中市豐原區社興路37號
4847,臺中市,豐原翁子郵局,420臺中市豐原區翁子里豐勢路一段576、578號
4848,臺中市,全家便利商店豐原西勢路互助店(公話),420臺中市豐原區西勢路411號
4849,臺中市,統一超商豐原西勢路晉豐店(公話),420臺中市豐原區西勢路425號
4850,臺中市,臺中市豐原地政事務所,420臺中市豐原區西安街21號
4851,臺中市,統一超商豐原西安街瑞彬店(公話),420臺中市豐原區西安街68號1樓
4852,臺中市,統一超商豐原豐中路豐勇店(公話),420臺中市豐原區豐中路129號
4853,臺中市,全家便利商店豐原豐中路榮豐店(公話),420臺中市豐原區豐中路79號
4854,臺中市,統一超商豐原豐勢路豐尚店(公話),420臺中市豐原區豐勢路2段680號
4855,臺中市,統一超商豐原豐勢路豐泰店(公話),420臺中市豐原區豐勢路二段396號
4856,臺中市,全家便利商店豐原豐勢路真樂店(公話),420臺中市豐原區豐勢路二段787號
4857,臺中市,臺中市立豐原體育場,420臺中市豐原區豐北街221號
4858,臺中市,全家便利商店豐原豐北街金旺店(公話),420臺中市豐原區豐北街246號
4859,臺中市,統一超商豐原豐南街新豐田店(公話),420臺中市豐原區豐南街145號
4860,臺中市,萊爾富便利商店豐原豐南街豐田店(公話),420臺中市豐原區豐南街58號
4861,臺中市,豐原葫蘆墩郵局,420臺中市豐原區豐原大道7段25號
4862,臺中市,統一超商豐原豐原大道豐環店(公話),420臺中市豐原區豐原大道一段370號
4863,臺中市,統一超商豐原豐原大道東洲店(公話),420臺中市豐原區豐原大道七段488號
4864,臺中市,統一超商豐原豐原大道瑞慶店(公話),420臺中市豐原區豐原大道三段261號
4865,臺中市,公路總局臺中區監理所豐原監理站,420臺中市豐原區豐東路120號
4866,臺中市,全家便利商店豐原豐東路豐東店(公話),420臺中市豐原區豐東路122號
4867,臺中市,統一超商豐原豐東路豐東店(公話),420臺中市豐原區豐東路218號
4868,臺中市,統一超商豐原豐東路豐村店(公話),420臺中市豐原區豐東路412號
4869,臺中市,全家便利商店豐原豐陽路太陽店(公話),420臺中市豐原區豐陽路109號
4870,臺中市,統一超商豐原鎌村路水豐店(公話),420臺中市豐原區鎌村路462號
4871,臺中市,全家便利商店豐原鎌村路鐮村店(公話),420臺中市豐原區鎌村路649號
4872,臺中市,豐原鐮村郵局,420臺中市豐原區鐮村里鐮村路169號
4873,臺中市,國軍退除役官兵輔導委員會臺中市榮服處一樓大廳,420臺中市豐原區陽明街20號
4874,臺中市,臺中市政府陽明大樓,420臺中市豐原區陽明街36號
4875,臺中市,臺中市政府陽明大樓-5F,420臺中市豐原區陽明街36號
4876,臺中市,臺中市政府陽明大樓-中庭,420臺中市豐原區陽明街36號
4877,臺中市,統一超商后里三光路久豐店(公話),421臺中市后里區三光路36號
4878,臺中市,統一超商后里三豐路后寶店(公話),421臺中市后里區三豐路113號之24
4879,臺中市,統一超商后里三豐路寶利旺店(公話),421臺中市后里區三豐路227號之3
4880,臺中市,臺中市統一超商后里三豐路彩豐店(公話),421臺中市后里區三豐路473號之5
4881,臺中市,全家便利商店后里公安路旺安店(公話),421臺中市后里區公安路105號
4882,臺中市,臺中市后里區公所,421臺中市后里區公安路84號
4883,臺中市,臺中市后里區衛生所,421臺中市后里區公安路86號
4884,臺中市,臺中市后里區圖書館,421臺中市后里區墩東里文化路28號
4885,臺中市,后里郵局,421臺中市后里區墩西村公安路77號
4886,臺中市,臺中市后里區戶政事務所,421臺中市后里區墩西里公安路90號
4887,臺中市,臺鐵局泰安站候車室,421臺中市后里區安眉路37-12號
4888,臺中市,臺中市鐵路工會新泰安站(公話),421臺中市后里區安眉路37號之12
4889,臺中市,臺中后里馬場-入口左側燈桿,421臺中市后里區寺山路41號?
4890,臺中市,泰安南站大客車,421臺中市后里區月眉里安眉路113號
4891,臺中市,高速公路局泰安服務區客席區與服務台(南站),421臺中市后里區月眉里安眉路113號
4892,臺中市,泰安北站大客車,421臺中市后里區月眉里雲頭路3-3號
4893,臺中市,交通部高速公路局第二新建工程處,421臺中市后里區月眉里雲頭路44號之35
4894,臺中市,統一超商后里民生路后冠店(公話),421臺中市后里區民生路1號
4895,臺中市,統一超商后里民生路月眉店(公話),421臺中市后里區民生路226號
4896,臺中市,后里義里郵局,421臺中市后里區甲后路193號
4897,臺中市,全家便利商店后里甲后路新中興店公話,421臺中市后里區甲后路196號
4898,臺中市,臺鐵局后里站候車室,421臺中市后里區甲后路1號
4899,臺中市,兆豐國際商銀后里分行,421臺中市后里區甲后路619之1號
4900,臺中市,統一超商后里甲后路后興店(公話),421臺中市后里區甲后路742號
4901,臺中市,統一超商后里甲后路后糖店(公話),421臺中市后里區甲后路835號
4902,臺中市,后里月眉郵局,421臺中市后里區甲后路843號
4903,臺中市,統一超商后里甲后路后東店(公話),421臺中市后里區甲后路97號
4904,臺中市,統一超商后里福美路福豐店(公話),421臺中市后里區福美路17號
4905,臺中市,自來水公司后里服務所,421臺中市后里區舊社路2-1號
4906,臺中市,內政部警政署國道公路警察局泰安分隊,421臺中市后里區雲頭路3之5號
4907,臺中市,高速公路局泰安服務區客席區與服務台(北站),421臺中市后里區雲頭路3之5號
4908,臺中市,臺中后豐鐵馬道起點-電力桿-1,422臺中市后里區豐原國道四號線高架橋下
4909,臺中市,臺中后豐鐵馬道起點-電力桿-2,422臺中市后里區豐原國道四號線高架橋下
4910,臺中市,臺中市土牛客家文化館,422臺中市石岡區土牛村豐勢路德成巷10號
4911,臺中市,統一超商石岡明德路新石岡店(公話),422臺中市石岡區明德路118號
4912,臺中市,臺中市石岡區圖書館,422臺中市石岡區明德路175號
4913,臺中市,全家便利商店石岡明德路登峰店(公話),422臺中市石岡區明德路179號
4914,臺中市,臺中市石岡區戶政事務所,422臺中市石岡區明德路18號
4915,臺中市,臺中石岡旅客服務中心左側,422臺中市石岡區石城街1號
4916,臺中市,臺中市石岡區衛生所,422臺中市石岡區石岡街6號
4917,臺中市,石岡郵局,422臺中市石岡區石岡街86號
4918,臺中市,水利署中區水資源局石岡壩管理中心,422臺中市石岡區石岡里豐勢路1238號
4919,臺中市,臺中市石岡區公所,422臺中市石岡區豐勢路1033號
4920,臺中市,華南商業銀行東勢分行,423臺中市東勢區三民街282號
4921,臺中市,自來水公司東勢營運所,423臺中市東勢區中寧里正一街8號
4922,臺中市,臺中市東勢區形象商圈(中山路1號),423臺中市東勢區中山路1號
4923,臺中市,臺中東勢客家文物館-後方公話亭,423臺中市東勢區中山路1號
4924,臺中市,臺中東勢客家文物館-正門右柱,423臺中市東勢區中山路1號
4925,臺中市,臺中市東勢區形象商圈(中山路42號),423臺中市東勢區中山路42號
4926,臺中市,臺中市東勢區形象商圈(中山路5號),423臺中市東勢區中山路5號
4927,臺中市,台電公司東勢服務所大廳,423臺中市東勢區中新街西新巷88-1號
4928,臺中市,統一超商東勢中正路東關店(公話),423臺中市東勢區中正路191號
4929,臺中市,全家便利商店東勢中正路客進店(公話),423臺中市東勢區中正路1號
4930,臺中市,全家便利商店東勢勢林街勢林店(公話),423臺中市東勢區勢林街230號
4931,臺中市,臺中市政府東勢客家文化園區-1F,423臺中市東勢區廣興里中山路1號
4932,臺中市,臺中市東勢客家文化園區,423臺中市東勢區廣興里中山路1號
4933,臺中市,東勢郵局,423臺中市東勢區廣興里中山路43號
4934,臺中市,東勢中嵙口郵局,423臺中市東勢區延平里豐勢路188、190號
4935,臺中市,全家便利商店東勢東崎路嶺先店(公話),423臺中市東勢區東崎路五段367號
4936,臺中市,臺中市老人福利服務中心,423臺中市東勢區東蘭路1-4附1號
4937,臺中市,臺中市地方稅務局_東勢分局,423臺中市東勢區東蘭路25-2號
4938,臺中市,臺中市東勢地政事務所,423臺中市東勢區東蘭路26號
4939,臺中市,統一超商東勢東蘭路東泰店(公話),423臺中市東勢區東蘭路41號之5
4940,臺中市,統一超商東勢東關路大矛埔店(公話),423臺中市東勢區東關路298號之6
4941,臺中市,財政部中區國稅局東勢稽徵所,423臺中市東勢區正二街臨1號
4942,臺中市,統一超商東勢第一橫街速華店(公話),423臺中市東勢區第一橫街153號
4943,臺中市,臺中市統一超商東勢第五橫街欣東雲店(公話),423臺中市東勢區第五橫街28號
4944,臺中市,第一商業銀行(東勢分行),423臺中市東勢區豐勢路105號
4945,臺中市,全家便利商店東勢豐勢路東豐店(公話),423臺中市東勢區豐勢路215號
4946,臺中市,統一超商東勢豐勢路東展店(公話),423臺中市東勢區豐勢路336號
4947,臺中市,彰化商業銀行東勢分行,423臺中市東勢區豐勢路456號
4948,臺中市,全家便利商店東勢豐勢路豐勢店(公話),423臺中市東勢區豐勢路482號
4949,臺中市,臺中市豐客客運東勢站(公話),423臺中市東勢區豐勢路488號
4950,臺中市,臺中市東勢區衛生所,423臺中市東勢區豐勢路490號
4951,臺中市,臺中市東勢區戶政事務所,423臺中市東勢區豐勢路516號
4952,臺中市,臺中市東勢區公所,423臺中市東勢區豐勢路518號
4953,臺中市,臺中市東勢區圖書館,423臺中市東勢區豐勢路518號
4954,臺中市,臺中市和平區中坑里里辦公處,424臺中市和平區中坑里中坑路中坑巷41號之1
4955,臺中市,和平郵局,424臺中市和平區南勢村東關路三段160-9號
4956,臺中市,臺中市和平區戶政事務所,424臺中市和平區南勢里巴新街8號
4957,臺中市,臺中市和平區農會,424臺中市和平區南勢里東關路三段161號
4958,臺中市,和平谷關郵局,424臺中市和平區博愛村東關路一段106號
4959,臺中市,臺中市和平區天輪里里辦公處,424臺中市和平區天輪里東關路二段天輪巷1-1號
4960,臺中市,臺中市和平區環山活動中心,424臺中市和平區平等里中13鄰中興路三段環山一巷18號
4961,臺中市,臺中市和平區平等里,424臺中市和平區平等里中13鄰中興路三段環山二巷22號
4962,臺中市,臺中市和平區平等國民小學,424臺中市和平區平等里中興路三段環山三巷35號
