2244,宜蘭縣,冬山河森林公園,269宜蘭縣冬山鄉冬山路三段
2245,宜蘭縣,宜蘭縣冬山河森林公園,269宜蘭縣冬山鄉冬山路三段
2246,宜蘭縣,冬山郵局,269宜蘭縣冬山鄉南興村10鄰冬山路177號
2247,宜蘭縣,宜蘭縣冬山鄉冬山國小活動中心面向香南路,269宜蘭縣冬山鄉安中路35號
2248,宜蘭縣,宜蘭縣政府警察局廣興派出所,269宜蘭縣冬山鄉廣興路193號
2249,宜蘭縣,冬山鄉梅花湖風景區,269宜蘭縣冬山鄉得安村環湖路
2250,宜蘭縣,宜蘭縣梅花湖風景特定區,269宜蘭縣冬山鄉得安村環湖路
2251,宜蘭縣,廣興消防分隊,269宜蘭縣冬山鄉復興路382號
2252,宜蘭縣,經濟部工業局龍德工業區污水處理廠,269宜蘭縣冬山鄉德興11路1號
2253,宜蘭縣,仁山植物園,269宜蘭縣冬山鄉新寮路500號
2254,宜蘭縣,宜蘭縣冬山鄉東興國小科任教室大樓2樓牆面朝東城路,269宜蘭縣冬山鄉東城路316號
2255,宜蘭縣,行政院農業委員會林務局羅東林區管理處冬山工作站,269宜蘭縣冬山鄉東岳村新寮二路688號
2256,宜蘭縣,內政部移民署宜蘭收容所,269宜蘭縣冬山鄉梅花路255巷22弄33號
2257,宜蘭縣,宜蘭縣立順安國中傳達室牆面朝本校大門口,269宜蘭縣冬山鄉永興路1段359號
2258,宜蘭縣,宜蘭縣政府警察局順安派出所,269宜蘭縣冬山鄉義成路2段394號
2259,宜蘭縣,冬山群英郵局,269宜蘭縣冬山鄉義成路三段482號
2260,宜蘭縣,臺北榮總蘇澳分院門診大樓一樓,270宜蘭縣蘇澳鎮中山路139號
2261,宜蘭縣,宜蘭縣蘇澳鎮蘇澳國小活動中心一樓廁所牆面,270宜蘭縣蘇澳鎮中山路1段366號
2262,宜蘭縣,宜蘭縣立蘇澳國中體育館二樓牆面朝志成路,270宜蘭縣蘇澳鎮中山路2段1號
2263,宜蘭縣,臺鐵局蘇澳新站候車室,270宜蘭縣蘇澳鎮中山路2段238號
2264,宜蘭縣,宜蘭縣政府警察局新城派出所,270宜蘭縣蘇澳鎮中山路2段493號
2265,宜蘭縣,彰化商業銀行蘇澳分行,270宜蘭縣蘇澳鎮中山路一段121號1樓
2266,宜蘭縣,中油公司宜蘭縣蘇澳鎮蘇澳站,270宜蘭縣蘇澳鎮中山路一段196號
2267,宜蘭縣,蘇澳郵局,270宜蘭縣蘇澳鎮中山路一段1號
2268,宜蘭縣,宜蘭縣警察局蘇澳分局,270宜蘭縣蘇澳鎮中山路一段252號
2269,宜蘭縣,蘇澳蘇西里郵局,270宜蘭縣蘇澳鎮中山路一段253號
2270,宜蘭縣,蘇澳鎮戶政事務所,270宜蘭縣蘇澳鎮中山路一段254號
2271,宜蘭縣,交通部公路總局第四區養護工程處-1F,270宜蘭縣蘇澳鎮中山路二段3號
2272,宜蘭縣,交通部公路總局第四區養護工程處-2F,270宜蘭縣蘇澳鎮中山路二段3號
2273,宜蘭縣,交通部公路總局第四區養護工程處-2F第2會議室,270宜蘭縣蘇澳鎮中山路二段3號
2274,宜蘭縣,第一商業銀行(蘇澳分行),270宜蘭縣蘇澳鎮中山路１段12號
2275,宜蘭縣,宜蘭縣蘇澳鎮士敏國小行政大樓二樓牆面朝生態池,270宜蘭縣蘇澳鎮光明路8號
2276,宜蘭縣,臺鐵局南澳站候車室,270宜蘭縣蘇澳鎮南強里大通路22號
2277,宜蘭縣,交通部觀光局東北角暨宜蘭海岸國家風景區管理處南方澳遊客中心,270宜蘭縣蘇澳鎮南正里江夏路85號
2278,宜蘭縣,宜蘭縣蘇澳鎮蓬萊國小辦公室大樓二樓樓面,270宜蘭縣蘇澳鎮南澳路85號
2279,宜蘭縣,臺灣土地銀行蘇澳分行,270宜蘭縣蘇澳鎮太平路17號
2280,宜蘭縣,臺鐵局蘇澳站候車室,270宜蘭縣蘇澳鎮太平路1號
2281,宜蘭縣,宜蘭縣蘇澳鎮岳明國小電腦教室陽台外與綠能球場間牆面,270宜蘭縣蘇澳鎮嶺腳路140號
2282,宜蘭縣,蘇澳鎮衛生所,270宜蘭縣蘇澳鎮志成路60號
2283,宜蘭縣,宜蘭縣武荖坑風景區(露營登記處),270宜蘭縣蘇澳鎮武荖坑路75號
2284,宜蘭縣,宜蘭縣武荖坑風景區遊客中心,270宜蘭縣蘇澳鎮武荖坑路75號
2285,宜蘭縣,武荖坑風景區(遊客中心),270宜蘭縣蘇澳鎮武荖坑路75號
2286,宜蘭縣,武荖坑風景區(露營登記處),270宜蘭縣蘇澳鎮武荖坑路75號
2287,宜蘭縣,蘇澳馬賽郵局,270宜蘭縣蘇澳鎮永榮里大同路226號
2288,宜蘭縣,宜蘭縣蘇澳鎮永樂國小三年級教室外牆朝校門口,270宜蘭縣蘇澳鎮永樂路1號
2289,宜蘭縣,臺鐵局永樂站候車室,270宜蘭縣蘇澳鎮永樂里圳頭路60號
2290,宜蘭縣,蘇澳南方澳郵局,270宜蘭縣蘇澳鎮江夏路13號
2291,宜蘭縣,南方澳消防分隊,270宜蘭縣蘇澳鎮海邊路138號
2292,宜蘭縣,基隆港務分公司蘇澳港營運處大樓2、3、4樓,270宜蘭縣蘇澳鎮港區1號
2293,宜蘭縣,宜蘭縣政府警察局港邊派出所,270宜蘭縣蘇澳鎮港邊里蘇濱路1段195號
2294,宜蘭縣,宜蘭縣政府警察局南方澳派出所,270宜蘭縣蘇澳鎮漁港路84號
2295,宜蘭縣,臺鐵局蘇澳新站大廳,270宜蘭縣蘇澳鎮聖愛里中山路2段238號
2296,宜蘭縣,臺鐵局蘇澳新站第1月台7車位置,270宜蘭縣蘇澳鎮聖愛里中山路2段238號
2297,宜蘭縣,蘇澳鎮圖書館-1F民眾用電腦上方,270宜蘭縣蘇澳鎮聖湖里育才路6號
2298,宜蘭縣,蘇澳鎮圖書館-2F電梯旁牆上,270宜蘭縣蘇澳鎮聖湖里育才路6號
2299,宜蘭縣,龍德(兼利澤)工業區服務中心,270宜蘭縣蘇澳鎮自強路12號
2300,宜蘭縣,臺鐵局蘇澳站第1月台北端,270宜蘭縣蘇澳鎮蘇南里太平路1號
2301,宜蘭縣,臺鐵局蘇澳站第1月台南端,270宜蘭縣蘇澳鎮蘇南里太平路1號
2302,宜蘭縣,高速公路蘇澳服務區,270宜蘭縣蘇澳鎮蘇新路101號
2303,宜蘭縣,蘇澳鎮公所-1F,270宜蘭縣蘇澳鎮蘇港路215號
2304,宜蘭縣,蘇澳鎮公所-1F後方,270宜蘭縣蘇澳鎮蘇港路215號
2305,宜蘭縣,蘇澳消防分隊,270宜蘭縣蘇澳鎮蘇港路80號
2306,宜蘭縣,臺北榮總蘇澳分院市區門診大樓一樓掛號區,270宜蘭縣蘇澳鎮蘇濱路一段301號
2307,宜蘭縣,蘇澳港邊里郵局,270宜蘭縣蘇澳鎮蘇濱路一段301號
2308,宜蘭縣,宜蘭縣政府警察局馬賽派出所,270宜蘭縣蘇澳鎮隘丁路12號
2309,宜蘭縣,馬賽消防分隊,270宜蘭縣蘇澳鎮隘丁路14號
2310,宜蘭縣,行政院農業委員會林務局羅東林區管理處南澳工作站,272宜蘭縣南澳鄉中正路55號
2311,宜蘭縣,宜蘭縣政府警察局南澳分駐所,272宜蘭縣南澳鄉南澳村蘇花路2段373號
2312,宜蘭縣,臺鐵局東澳站候車室,272宜蘭縣南澳鄉東岳村1號
2313,宜蘭縣,臺鐵局東澳站第1月台6車位置,272宜蘭縣南澳鄉東岳村1號
2314,宜蘭縣,宜蘭縣政府警察局東澳派出所,272宜蘭縣南澳鄉東岳村蘇花路3段161號
2315,宜蘭縣,花蓮縣壽豐鄉平和路30號,272宜蘭縣南澳鄉武塔村新溪路18號
2316,宜蘭縣,宜蘭縣政府警察局武塔派出所,272宜蘭縣南澳鄉武塔村新溪路5號
2317,宜蘭縣,宜蘭縣南澳鄉德卡倫部落,272宜蘭縣南澳鄉澳花村中央路18-2號
2318,宜蘭縣,南澳衛生所-澳花村衛生室,272宜蘭縣南澳鄉澳花村中央路52號
2319,宜蘭縣,臺鐵局漢本站候車室,272宜蘭縣南澳鄉澳花村蘇花路1段56號
2320,宜蘭縣,宜蘭縣政府警察局碧候派出所,272宜蘭縣南澳鄉碧侯村信義路陽明巷78號
2321,宜蘭縣,宜蘭縣南澳鄉碧候國小二樓校長室外朝向全校園空間,272宜蘭縣南澳鄉碧候路自覺巷38號
2322,宜蘭縣,南澳鄉圖書館-2FA,272宜蘭縣南澳鄉蘇花路2段381號3樓
2323,宜蘭縣,南澳鄉圖書館-2FB,272宜蘭縣南澳鄉蘇花路2段381號3樓
2324,宜蘭縣,南澳衛生所-東岳村衛生室,272宜蘭縣南澳鄉蘇花路3段165號
2325,宜蘭縣,蘇澳東澳路郵局,272宜蘭縣南澳鄉蘇花路三段171號
2326,宜蘭縣,南澳郵局,272宜蘭縣南澳鄉蘇花路二段351號
2327,宜蘭縣,南澳消防分隊,272宜蘭縣南澳鄉蘇花路二段365號
2328,宜蘭縣,南澳鄉衛生所,272宜蘭縣南澳鄉蘇花路二段375號
2329,宜蘭縣,南澳鄉公所-1F右,272宜蘭縣南澳鄉蘇花路二段381號
2330,宜蘭縣,南澳鄉公所-1F左,272宜蘭縣南澳鄉蘇花路二段381號
2331,宜蘭縣,南澳鄉戶政事務所,272宜蘭縣南澳鄉蘇花路二段431號
2332,宜蘭縣,南澳衛生所-金岳村衛生室,272宜蘭縣南澳鄉金岳村金岳路8號
2333,宜蘭縣,南澳衛生所-金洋村衛生室,272宜蘭縣南澳鄉金洋村金洋路9之1號
2334,宜蘭縣,宜蘭縣南澳鄉金洋國小風雨教室屋簷下牆面,272宜蘭縣南澳鄉金洋路11號
2335,新竹市,新竹市文化局圖書館南寮分館,300新竹市北區中光路17號2樓
2336,新竹市,新竹市警察局刑警大隊,300新竹市北區中山路1號
2337,新竹市,新竹市城隍廟旁廣場(右側),300新竹市北區中山路75號
2338,新竹市,新竹市城隍廟旁廣場(左側),300新竹市北區中山路75號
2339,新竹市,新竹市政府中庭,300新竹市北區中正路120號
2340,新竹市,新竹市政府大禮堂前,300新竹市北區中正路120號
2341,新竹市,新竹市政府府前廣場(右側),300新竹市北區中正路120號
2342,新竹市,新竹市政府府前廣場(左側),300新竹市北區中正路120號
2343,新竹市,兆豐國際商銀北新竹分行,300新竹市北區中正路129號
2344,新竹市,新竹市政府都發處四合一櫃檯,300新竹市北區中正路146號
2345,新竹市,內政部移民署新竹市服務站,300新竹市北區中華路3段12號1、2樓
2346,新竹市,新竹市警察局第二分局,300新竹市北區光復路二段798號
2347,新竹市,新竹光華街郵局,300新竹市北區光華北街87號
2348,新竹市,勞動部勞動力發展署桃竹苗分署新竹就業中心洽公櫃台,300新竹市北區光華東街56號
2349,新竹市,新竹西門郵局,300新竹市北區北大路471號
2350,新竹市,智慧財產局新竹服務處,300新竹市北區北大路68號5樓
2351,新竹市,水利署第二河川局1樓服務台,300新竹市北區北大路97號
2352,新竹市,新竹南勢郵局,300新竹市北區南勢里延平路一段373號
2353,新竹市,新竹市南寮旅遊服務中心前廣場,300新竹市北區南寮街261號
2354,新竹市,新竹市北區衛生所,300新竹市北區國華街69號1樓1F
2355,新竹市,新竹市北區戶政事務所,300新竹市北區國華街69號2樓
2356,新竹市,新竹市北區區公所3樓,300新竹市北區國華街69號3樓
2357,新竹市,內政部移民署新竹收容所,300新竹市北區崧嶺路122號
2358,新竹市,衛生福利部少年之家,300新竹市北區崧嶺路181號
2359,新竹市,國軍退除役官兵輔導委員會新竹榮譽國民之家嵩德樓一樓大廳,300新竹市北區崧嶺路57巷41號
2360,新竹市,新竹市殯葬管理所服務中心,300新竹市北區成德路132號1F
2361,新竹市,新竹市殯葬管理所新館禮廳(右側),300新竹市北區成德路132號2F
2362,新竹市,新竹市殯葬管理所新館禮廳(左側),300新竹市北區成德路132號2F
2363,新竹市,新竹市殯葬管理所新館靈堂,300新竹市北區成德路132號2F
2364,新竹市,新竹市殯葬管理所舊館左側靈堂,300新竹市北區成德路132號2F
2365,新竹市,新竹市天鵝湖(南寮舊漁港),300新竹市北區新港一路
2366,新竹市,新竹市南寮漁港-室外表演舞台,300新竹市北區新港三路附近
2367,新竹市,新竹市南寮漁港2樓(右區),300新竹市北區新港三路附近
2368,新竹市,新竹市文化局圖書館B1寶兔室,300新竹市北區東大路2段15巷1號
2369,新竹市,新竹市文化局圖書館B3期刊室,300新竹市北區東大路2段15巷1號
2370,新竹市,新竹市文化局荷花池廣場,300新竹市北區東大路2段15巷1號
2371,新竹市,新竹市文化局2樓,300新竹市北區東大路2段15巷1號2F
2372,新竹市,新竹市文化局3樓,300新竹市北區東大路2段15巷1號3樓
2373,新竹市,新竹市文化局圖書館3F自修室,300新竹市北區東大路2段15巷1號3樓
2374,新竹市,新竹市眷村博物館,300新竹市北區東大路二段105號
2375,新竹市,彰化商業銀行北新竹分行,300新竹市北區東大路二段110號
2376,新竹市,新竹市文化局圖書館1F閱覽室,300新竹市北區東大路二段15巷1號1樓
2377,新竹市,新竹樹林頭郵局,300新竹市北區東大路二段449號
2378,新竹市,第一商業銀行東門分行,300新竹市北區東門街216號
2379,新竹市,新竹市北區樂齡學習中心,300新竹市北區武陵路111-1號
2380,新竹市,新竹市湳雅公園,300新竹市北區武陵路196巷2號
2381,新竹市,國軍桃園總醫院新竹分院急診室等候區,300新竹市北區武陵路3號
2382,新竹市,國軍桃園總醫院新竹分院病房護理站,300新竹市北區武陵路3號
2383,新竹市,國軍桃園總醫院新竹分院藥局等候區,300新竹市北區武陵路3號
2384,新竹市,國軍桃園總醫院新竹分院門診檢查區,300新竹市北區武陵路3號
2385,新竹市,國軍桃園總醫院新竹分院門診等候區,300新竹市北區武陵路3號
2386,新竹市,國軍桃園總醫院新竹分院體檢中心,300新竹市北區武陵路3號
2387,新竹市,新竹市環境保護局1樓,300新竹市北區海濱路240號
2388,新竹市,新竹文雅郵局,300新竹市北區竹光路218號
2389,新竹市,新竹經國路郵局,300新竹市北區經國路二段56號1樓
2390,新竹市,新竹英明街郵局,300新竹市北區英明街10號
2391,新竹市,第一商業銀行(新竹分行),300新竹市北區英明街3號
2392,新竹市,新竹市立棒球場前入口廣場(目前暫停使用中),300新竹市北區西大路523號
2393,新竹市,新竹市消防局1樓,300新竹市北區西大路679號
2394,新竹市,新竹市消防局災害應變中心,300新竹市北區西大路679號
2395,新竹市,新竹南寮郵局,300新竹市北區西濱路一段480號
2396,新竹市,新竹市稅務局1樓,300新竹市東區中央路112號
2397,新竹市,新竹市稅務局3樓,300新竹市東區中央路112號
2398,新竹市,財政部北區國稅局新竹市分局第2辦公室,300新竹市東區中央路112號6樓
2399,新竹市,臺灣土地銀行新竹分行,300新竹市東區中央路1號
2400,新竹市,新竹市遠東巨城購物中心前廣場(右側),300新竹市東區中央路229號
2401,新竹市,新竹市遠東巨城購物中心前廣場(左側),300新竹市東區中央路229號
2402,新竹市,新竹市社福大樓10樓服務台,300新竹市東區中央路241號
2403,新竹市,新竹市終身教育學習中心,300新竹市東區中央路241號
2404,新竹市,新竹市政府地政處民眾洽公處,300新竹市東區中正路120號
2405,新竹市,新竹市政府服務中心,300新竹市東區中正路120號
2406,新竹市,新竹市產業發展處工商科民眾洽公處,300新竹市東區中正路120號
2407,新竹市,彰化商業銀行新竹分行,300新竹市東區中正路63號
2408,新竹市,新竹市影像博物館2F放映大廳,300新竹市東區中正路65號
2409,新竹市,新竹市影像博物館前廣場,300新竹市東區中正路65號
2410,新竹市,新竹市東門城地下道(東南向),300新竹市東區中正路東門街
2411,新竹市,新竹市東門城地下道(西北向),300新竹市東區中正路東門街
2412,新竹市,新竹市東門城玻璃橋,300新竹市東區中正路東門街
2413,新竹市,台電公司新竹區處服務中心營業廳,300新竹市東區中華路2段400號
2414,新竹市,臺鐵局新竹站候車大廳,300新竹市東區中華路2段445號
2415,新竹市,臺鐵局新竹站第1月台南端天橋樓梯處,300新竹市東區中華路2段445號
2416,新竹市,新竹市公車(苗栗客運-綠線[809-U7]),300新竹市東區中華路一段78巷18弄11號
2417,新竹市,新竹市公車(苗栗客運-綠線[810-U7]),300新竹市東區中華路一段78巷18弄11號
2418,新竹市,新竹市公車(苗栗客運-綠線[812-U7]),300新竹市東區中華路一段78巷18弄11號
2419,新竹市,新竹市公車(苗栗客運-綠線[813-U7]),300新竹市東區中華路一段78巷18弄11號
2420,新竹市,新竹市公車(苗栗客運-綠線[819-U7]),300新竹市東區中華路一段78巷18弄11號
2421,新竹市,新竹市公車(苗栗客運-綠線[821-U7]),300新竹市東區中華路一段78巷18弄11號
2422,新竹市,國泰醫院新竹院區1F-啦叭旁邊(試辦單位-暫停服務至2016/12/31),300新竹市東區中華路二段678號1F
2423,新竹市,國泰醫院新竹院區2F(試辦單位-暫停服務至2016/12/31),300新竹市東區中華路二段678號2F
2424,新竹市,國泰醫院新竹院區3F(試辦單位-暫停服務至2016/12/31),300新竹市東區中華路二段678號3F
2425,新竹市,國泰醫院新竹院區3F-陽台(試辦單位-暫停服務至2016/12/31),300新竹市東區中華路二段678號3F陽台
2426,新竹市,國泰醫院新竹院區5F(試辦單位-暫停服務至2016/12/31),300新竹市東區中華路二段678號5F
2427,新竹市,國泰醫院新竹院區B1F-啦叭旁邊(試辦單位-暫停服務至2016/12/31),300新竹市東區中華路二段678號B1F
2428,新竹市,新竹市護城河岸東門橋(左側),300新竹市東區信義街
2429,新竹市,新竹市護城河岸東門橋右側,300新竹市東區信義街
2430,新竹市,國立清華大學學習資源中心,300新竹市東區光復路2段101號
2431,新竹市,新竹市東區金山圖書館,300新竹市東區光復路一段163巷53弄1之4號2樓
2432,新竹市,新竹關東橋郵局,300新竹市東區光復路一段313號
2433,新竹市,國立清華大學小吃部,300新竹市東區光復路二段101號
2434,新竹市,國立清華大學成功湖畔,300新竹市東區光復路二段101號
2435,新竹市,清華大學郵局,300新竹市東區光復路二段99號
2436,新竹市,第一商業銀行(竹科分行),300新竹市東區光復路１段611號
2437,新竹市,新竹市地政事務所1樓,300新竹市東區光華東街60號1F
2438,新竹市,新竹市長青學苑旁公園,300新竹市東區公園路255號
2439,新竹市,新竹公園(動物園圖書館分館),300新竹市東區公園路279號
2440,新竹市,新竹公園(動物園辦公室)右側,300新竹市東區公園路279號B1
2441,新竹市,新竹公園(動物園辦公室)左側,300新竹市東區公園路279號B1
2442,新竹市,新竹公園(田徑場前廣場)(目前暫停使用中),300新竹市東區公園路283號
2443,新竹市,新竹公園(田徑場司令台)(目前暫停使用中),300新竹市東區公園路283號
2444,新竹市,新竹公園(田徑場外圍1)(目前暫停使用中),300新竹市東區公園路283號
2445,新竹市,新竹公園(田徑場外圍2)(目前暫停使用中),300新竹市東區公園路283號
2446,新竹市,新竹公園(田徑場外圍3)(目前暫停使用中),300新竹市東區公園路283號
2447,新竹市,新竹公園(田徑場外圍4)(目前暫停使用中),300新竹市東區公園路283號
2448,新竹市,新竹公園(孔廟前廣場)(目前暫停使用中),300新竹市東區公園路289號
2449,新竹市,新竹公園(體育館內右側),300新竹市東區公園路295號
2450,新竹市,新竹公園(體育館內左側),300新竹市東區公園路295號
2451,新竹市,新竹公園(體育館大廳),300新竹市東區公園路295號
2452,新竹市,兆豐國際商銀新竹分行,300新竹市東區公道五路二段417號
2453,新竹市,科技部新竹科學工業園區管理局-矽導商務中心公共區,300新竹市東區力行一路1號
2454,新竹市,科技部新竹科學工業園區管理局-矽導商務中心右辦公區,300新竹市東區力行一路1號
2455,新竹市,科技部新竹科學工業園區管理局-矽導商務中心左辦公區,300新竹市東區力行一路1號
2456,新竹市,科技部新竹科學工業園區管理局-矽導研發中心(1樓服務台及貴賓室),300新竹市東區力行一路1號
2457,新竹市,上海商銀新竹分行,300新竹市東區北大路115號
2458,新竹市,臺灣土地銀行東新竹分行,300新竹市東區北大路22號
2459,新竹市,財政部北區國稅局新竹市分局第1辦公室,300新竹市東區北大路90之2號1樓
2460,新竹市,財政部國有財產署中區分署新竹辦事處,300新竹市東區北大路94號
2461,新竹市,財政部國有財產署中區分署新竹辦事處2F洽公區,300新竹市東區北大路94號2樓
2462,新竹市,財政部國有財產署中區分署新竹辦事處3F洽公區,300新竹市東區北大路94號3樓
2463,新竹市,新竹市十八尖山介壽亭,300新竹市東區十八尖山介壽亭
2464,新竹市,新竹市十八尖山佛光岩,300新竹市東區十八尖山佛光岩
2465,新竹市,新竹市十八尖山幸福亭,300新竹市東區十八尖山幸福亭
2466,新竹市,新竹市十八尖山愛林亭,300新竹市東區十八尖山愛林亭
2467,新竹市,新竹市十八尖山獅子亭,300新竹市東區十八尖山獅子亭
2468,新竹市,新竹西大路郵局,300新竹市東區南大路428號
2469,新竹市,行政院勞動部勞工保險局新竹市辦事處洽公櫃台,300新竹市東區南大路42號
2470,新竹市,新竹南大路郵局,300新竹市東區南大路621號
2471,新竹市,自來水公司新竹服務所,300新竹市東區博愛街1號
2472,新竹市,新竹市政府勞工處,300新竹市東區國華街69號5樓
2473,新竹市,科技部新竹科學工業園區管理局-環境教育館,300新竹市東區園區一路4號
2474,新竹市,科技部新竹科學工業園區管理局-保警中隊,300新竹市東區園區一路8號
2475,新竹市,新竹市護城河岸大同橋(右側),300新竹市東區大同路
2476,新竹市,新竹市護城河岸大同橋(左側),300新竹市東區大同路
2477,新竹市,國立交通大學資訊技術服務中心,300新竹市東區大學路1001號
2478,新竹市,國立交通大學資訊技術服務中心外小木屋廣場,300新竹市東區大學路1001號
2479,新竹市,中油公司新竹直銷中心,300新竹市東區大學路2號
2480,新竹市,中油公司新竹服務中心,300新竹市東區大學路8之1號
2481,新竹市,新竹學府路郵局,300新竹市東區學府路128號
2482,新竹市,科技部新竹科學工業園區管理局-科技生活館,300新竹市東區工業東2路1號
2483,新竹市,關務署臺北關新竹科學工業園區支局,300新竹市東區工業東七路八號
2484,新竹市,臺灣銀行新竹科學園區分行,300新竹市東區工業東六路5號2樓
2485,新竹市,彰化商業銀行新竹科學園區分行,300新竹市東區工業東六路5號二樓
2486,新竹市,新竹市護城河岸圓環邊,300新竹市東區府後街
2487,新竹市,新竹市護城河岸土城橋右側(目前暫停使用),300新竹市東區府後街
2488,新竹市,新竹市護城河岸土城橋左側(目前暫停使用中),300新竹市東區府後街
2489,新竹市,新竹市青少年館,300新竹市東區府後街58號
2490,新竹市,新竹建中郵局,300新竹市東區建中一路8號
2491,新竹市,新竹市赤土崎公園光復中學站,300新竹市東區建中路2號
2492,新竹市,新竹市赤土崎公園新源街廣場(右側),300新竹市東區建中路2號
2493,新竹市,新竹市赤土崎公園新源街廣場(左側),300新竹市東區建中路2號
2494,新竹市,新竹市赤土崎公園馬階醫院站,300新竹市東區建中路2號
2495,新竹市,國軍退除役官兵輔導委員會新竹榮民服務處一樓大廳,300新竹市東區建功二路61號
2496,新竹市,新竹東園郵局,300新竹市東區忠孝路434巷3號
2497,新竹市,新竹市護城河岸文化街(目前暫停使用中),300新竹市東區文化街
2498,新竹市,科技部新竹科學工業園區管理局-勞工育樂中心,300新竹市東區新安路2-1號
2499,新竹市,科技部新竹科學工業園區管理局-勞工育樂中心,300新竹市東區新安路2-1號
2500,新竹市,科技部新竹科學工業園區管理局-勞工育樂中心地下室教室2,300新竹市東區新安路2-1號
2501,新竹市,科技部新竹科學工業園區管理局-勞工育樂中心地下室會議室,300新竹市東區新安路2-1號
2502,新竹市,科技部新竹科學工業園區管理局-勞工育樂中心禮堂,300新竹市東區新安路2-1號
2503,新竹市,科技部新竹科學工業園區管理局-管理局大樓,300新竹市東區新安路2-1號
2504,新竹市,科技部新竹科學工業園區管理局-巡迴巴士新安站,300新竹市東區新安路3號
2505,新竹市,新竹市站前廣場(SOGO前)右側(目前暫停使用中),300新竹市東區新竹火車站對面
2506,新竹市,新竹市站前廣場(SOGO前)左側(目前暫停使用中),300新竹市東區新竹火車站對面
2507,新竹市,新竹市站前廣場右側(目前暫停使用中),300新竹市東區新竹火車站對面
2508,新竹市,新竹市站前廣場左側(目前暫停使用中),300新竹市東區新竹火車站對面
2509,新竹市,臺鐵局新莊站售票房,300新竹市東區新莊里6鄰關東路310號
2510,新竹市,新竹客運轉運站(右側),300新竹市東區東南街1巷6號
2511,新竹市,新竹客運轉運站(左側),300新竹市東區東南街1巷6號
2512,新竹市,新竹客運轉運站二樓,300新竹市東區東南街1巷6號
2513,新竹市,臺鐵局北新竹站售票房,300新竹市東區東園里中華路1段291-2號
2514,新竹市,新竹市文化局前廣場(右側),300新竹市東區東大路2段15巷1號1F
2515,新竹市,新竹市文化局前廣場左側,300新竹市東區東大路2段15巷1號1F
2516,新竹市,新竹公園(昆蟲館)室內,300新竹市東區東大路一段2號
2517,新竹市,新竹公園(氣象站),300新竹市東區東大路一段2號
2518,新竹市,新竹公園玻工館右側(玻璃工坊1F),300新竹市東區東大路一段2號
2519,新竹市,華南商業銀行新竹分行,300新竹市東區東門街131號
